{
  "job_id": "job_click_element_example",
  "protocol_version": "0.1",
  "device_id": "mac_soumya_local",
  "kind": "ui.click_element",
  "risk": "consequential",
  "input": {
    "element_role": "AXButton",
    "element_label": "Continue"
  },
  "expires_at": "2026-07-15T12:00:30Z",
  "idempotency_key": "idem_click_element_example"
}
